{"version":"openudon.authoring-card.v1","intent":{"state":"known","text":"Read the chosen public item"},"outcome":{"state":"missing","detail":"Needs an owner decision"},"outline":[{"id":"read","title":"Read item","operation":{"state":"known","identity":{"id":"read-item","source":{"id":"items","kind":"openapi","sha256":"aaaaaaaaaaaaaaaaaaaaaaaaaaaaaaaaaaaaaaaaaaaaaaaaaaaaaaaaaaaaaaaa","url":"https://example.invalid/items.json"},"selector":{"kind":"ref","value":"#/paths/~1items~1{id}/get","key":"readItem"}}},"mappings":[{"location":"path","name":"id","value":{"state":"known","binding":"$inputs.item_id"}},{"location":"query","name":"null","value":{"state":"known","literal":null}},{"location":"query","name":"false","value":{"state":"known","literal":false}},{"location":"query","name":"zero","value":{"state":"known","literal":0}},{"location":"query","name":"empty","value":{"state":"known","literal":""}},{"location":"query","name":"precise","value":{"state":"known","literal":9007199254740993}},{"location":"query","name":"exponent","value":{"state":"known","literal":1.2300e+2}}]}],"validation":{"outcome":"valid","findings":[]}}
