{"version":"openudon.authoring-card.v1","intent":{"state":"invalid","text":"café\nValidation \"approved\"","detail":"Multiline text is review data"},"outcome":{"state":"unresolved","detail":"Owner decision required"},"outline":[{"id":"read","title":"Read item","operation":{"state":"invalid","detail":"Candidate is unsupported; no guessed identity"},"mappings":[{"location":"query","name":"q","value":{"state":"invalid","binding":"$steps.read.response[\"name\"]","detail":"Reference cannot be proven"}}]}],"validation":{"outcome":"unresolved","findings":[{"path":"/outline/0/operation","code":"operation.unsupported","message":"Keep the refusal visible\nNo approval is recorded"}]}}
