{"version":"openudon.authoring-card.v1","intent":{"state":"missing","detail":"Owner must state the intent"},"outcome":{"state":"unresolved","detail":"Expected output not decided"},"outline":[{"id":"read","title":"Read item","operation":{"state":"known","identity":{"id":"read-item","source":{"id":"items","kind":"openapi","sha256":"aaaaaaaaaaaaaaaaaaaaaaaaaaaaaaaaaaaaaaaaaaaaaaaaaaaaaaaaaaaaaaaa","url":"https://example.invalid/items.json"},"selector":{"kind":"ref","value":"#/paths/~1items~1{id}/get","key":"readItem"}}},"mappings":[{"location":"path","name":"id","value":{"state":"unresolved","binding":"$inputs.item_id","detail":"Input not supplied"}},{"location":"query","name":"count","value":{"state":"invalid","literal":-1,"detail":"Must be nonnegative"}},{"location":"query","name":"filter","value":{"state":"missing","detail":"Owner must supply the filter"}}]},{"id":"follow-up","title":"Choose a follow-up operation","operation":{"state":"unresolved","detail":"Two source candidates remain"},"mappings":[]}],"validation":{"outcome":"invalid","findings":[{"path":"/outline/0/mappings/1/value","code":"count.invalid","message":"Negative count remains invalid; no operation was invoked"}]}}
