{"version":"openudon.authoring-card.v1","intent":{"state":"known","text":"Read the chosen public item"},"outcome":{"state":"known","text":"The item is displayed"},"outline":[{"id":"read","title":"Read item","operation":{"state":"known","identity":{"id":"read-item","source":{"id":"functions","kind":"runtime-function","sha256":"bbbbbbbbbbbbbbbbbbbbbbbbbbbbbbbbbbbbbbbbbbbbbbbbbbbbbbbbbbbbbbbb"},"selector":{"kind":"id","value":"pure.identity","key":"pure.identity"}}},"mappings":[{"location":"input","name":"value","value":{"state":"known","literal":{"count":9007199254740993,"ratio":1.2300e+2,"nested":[null,false,""]}}}]}],"validation":{"outcome":"valid","findings":[]}}
